{
  "$schema": "./release-config.schema.json",
  "description": "Coordinated release configuration for CrewChief packages",
  "releaseOrder": [
    "@crewchief/cli",
    "@crewchief/maproom-mcp"
  ],
  "packages": {
    "@crewchief/cli": {
      "path": "packages/cli",
      "publishTo": ["npm"],
      "dependencies": [],
      "schemaVersion": 1,
      "notes": "Core CLI - must be released first as other packages depend on it"
    },
    "@crewchief/maproom-mcp": {
      "path": "packages/maproom-mcp",
      "publishTo": ["npm"],
      "dependencies": ["@crewchief/cli"],
      "requiredCliVersion": ">=1.5.0",
      "schemaVersion": 1,
      "notes": "MCP server - actively maintained. The recommended integration path for LLM agents and the universal way to connect Maproom to other systems, per the 'Clean Up and Promote' disposition in docs/decisions/component-disposition-matrix.md. Docs reference CLI for migrations/scanning."
    },
    "vscode-maproom": {
      "path": "packages/vscode-maproom",
      "publishTo": ["vscode-marketplace", "open-vsx"],
      "dependencies": [],
      "schemaVersion": 1,
      "deprecated": true,
      "notes": "VSCode extension - RETIRED (2026-07-10). Source kept in-tree. Replaced by @crewchief/maproom-mcp. Not in releaseOrder; will not be published."
    }
  },
  "rustBinary": {
    "crate": "crates/maproom",
    "name": "maproom",
    "platforms": ["linux-x64", "linux-arm64", "darwin-x64", "darwin-arm64", "win32-x64"],
    "_win32_note": "win32-x64 is listed for planned support but not yet built by reusable-rust-build.yml (no Windows runner or MSVC target configured). Add Windows matrix entry to reusable-rust-build.yml when win32 builds are needed."
  },
  "validation": {
    "requireCleanWorkingTree": true,
    "requirePassingTests": true,
    "requireVersionBump": true,
    "blockOnUnreleasedDependencies": true
  }
}
